{
  "@cotc": "enhanced_financial_compliance_contract",
  "version": "2.2",
  "contract_id": "fin-ai-trading-001",
  "governance": {
    "contract_type": "compliance",
    "severity": "critical",
    "compliance_requirements": ["SOX", "PCI_DSS", "NIST_CSF", "FINRA"],
    "stakeholders": [
      {
        "role": "chief_compliance_officer",
        "approval_required": true,
        "expertise_level": "compliance",
        "sox_certification_required": true
      },
      {
        "role": "trading_desk_manager",
        "notification_required": true,
        "expertise_level": "business",
        "escalation_threshold": 0.8
      }
    ]
  },
  "validation": {
    "validation_chain": [
      {
        "agent_type": "compliance",
        "agent_name": "sox_financial_validator",
        "authority_source": "SOX_Requirements_2024",
        "confidence_threshold": 0.98,
        "required": true
      },
      {
        "agent_type": "risk",
        "agent_name": "trading_risk_assessor",
        "specialization": "financial_markets",
        "validation_criteria": {
          "market_impact_analysis": true,
          "regulatory_capital_impact": true
        }
      }
    ]
  }
}
