{
  "@cotc": "enhanced_feature_multi_domain_contract",
  "version": "2.2",
  "contract_id": "ecom-ai-recommendations-002",
  "governance": {
    "contract_type": "feature",
    "severity": "high",
    "compliance_requirements": ["GDPR", "CCPA", "PCI_DSS", "ISO_27001", "LGPD"],
    "stakeholders": [
      {
        "role": "product_manager",
        "approval_required": true,
        "expertise_level": "business",
        "revenue_impact_authority": true
      },
      {
        "role": "privacy_officer",
        "notification_required": true,
        "expertise_level": "privacy",
        "multi_jurisdiction_expertise": true
      },
      {
        "role": "security_team",
        "notification_required": true,
        "expertise_level": "security",
        "pci_dss_certification": true
      },
      {
        "role": "data_protection_officer",
        "escalation_level": "privacy",
        "expertise_level": "privacy",
        "gdpr_specialist": true
      },
      {
        "role": "ml_ethics_officer",
        "bias_assessment_authority": true,
        "fairness_certification_required": true
      }
    ],
    "sla_requirements": {
      "resolution_time": "4_hours",
      "escalation_after": "2_hours",
      "business_impact_prioritization": true
    }
  },
  "validation": {
    "validation_chain": [
      {
        "agent_type": "compliance",
        "agent_name": "enhanced_gdpr_validator",
        "authority_source": "GDPR_Requirements_2024",
        "privacy_impact_assessment": true,
        "required": true,
        "validation_criteria": {
          "lawful_basis_verification": true,
          "data_subject_rights_implementation": true,
          "consent_mechanism_validation": true,
          "cross_border_transfer_compliance": true
        }
      },
      {
        "agent_type": "bias",
        "agent_name": "ml_fairness_validator",
        "authority_source": "AI_Ethics_Guidelines",
        "required": true,
        "validation_criteria": {
          "demographic_parity_assessment": true,
          "equalized_odds_verification": true,
          "individual_fairness_testing": true
        }
      }
    ]
  }
}
